[
  {
    "schema_version": "1.0",
    "event_id": "traffic-1:vehicle_counting:vehicle_count_per_frame:13051:2026-09-16T07:40:51.525044Z",
    "timestamp": "2026-09-16T07:40:51.525044Z",
    "camera_id": "traffic-1",
    "solution_pack": "sporada-secure",
    "application": "vehicle_counting",
    "event_type": "vehicle_count_per_frame",
    "payload": {
      "count": {"total": 2},
      "location": {"id": "traffic-1-vehicle-zone", "name": "vehicle_zone", "type": "zone"},
      "objects": [
        {"type": "car", "confidence": 0.94, "track_id": 41, "bbox": {"x1": 110, "y1": 220, "x2": 410, "y2": 570}},
        {"type": "motorcycle", "confidence": 0.88, "track_id": 52, "bbox": {"x1": 620, "y1": 250, "x2": 790, "y2": 610}}
      ],
      "snapshot_ref": "snapshots/traffic-1/vehicle-13051.jpg",
      "snapshot_url": "/snapshots/traffic-1/vehicle-13051.jpg",
      "snapshot_content_type": "image/jpeg",
      "snapshot_assets": {
        "event_frame": {"ref": "snapshots/traffic-1/vehicle-13051.jpg", "url": "/snapshots/traffic-1/vehicle-13051.jpg", "content_type": "image/jpeg"}
      }
    }
  },
  {
    "schema_version": "1.0",
    "event_id": "traffic-1:pedestrian_counting:pedestrian_count_per_frame:13051:2026-09-16T07:40:51.525132Z",
    "timestamp": "2026-09-16T07:40:51.525132Z",
    "camera_id": "traffic-1",
    "solution_pack": "sporada-secure",
    "application": "pedestrian_counting",
    "event_type": "pedestrian_count_per_frame",
    "payload": {
      "count": {"total": 1},
      "location": {"id": "traffic-1-people-zone", "name": "people_zone", "type": "zone"},
      "objects": [{"type": "person", "confidence": 0.91, "track_id": 17, "bbox": {"x1": 400, "y1": 120, "x2": 510, "y2": 650}}],
      "snapshot_ref": "snapshots/traffic-1/people-13051.jpg",
      "snapshot_url": "/snapshots/traffic-1/people-13051.jpg",
      "snapshot_content_type": "image/jpeg",
      "snapshot_assets": {
        "event_frame": {"ref": "snapshots/traffic-1/people-13051.jpg", "url": "/snapshots/traffic-1/people-13051.jpg", "content_type": "image/jpeg"}
      }
    }
  },
  {
    "schema_version": "1.0",
    "event_id": "traffic-1:fire_smoke_detection:smoke_detected:42:2026-09-16T07:41:00Z",
    "timestamp": "2026-09-16T07:41:00Z",
    "camera_id": "traffic-1",
    "solution_pack": "sporada-secure",
    "application": "fire_smoke_detection",
    "event_type": "smoke_detected",
    "payload": {
      "subject": {"type": "smoke", "confidence": 0.93, "bbox": {"x1": 300, "y1": 100, "x2": 720, "y2": 460}},
      "snapshot_ref": "snapshots/traffic-1/smoke-42.jpg",
      "snapshot_url": "/snapshots/traffic-1/smoke-42.jpg",
      "snapshot_content_type": "image/jpeg",
      "snapshot_assets": {
        "event_frame": {"ref": "snapshots/traffic-1/smoke-42.jpg", "url": "/snapshots/traffic-1/smoke-42.jpg", "content_type": "image/jpeg"}
      }
    }
  },
  {
    "schema_version": "1.0",
    "event_id": "traffic-1:anpr:plate_read:3487:2026-09-16T07:40:51.768138Z",
    "timestamp": "2026-09-16T07:40:51.768138Z",
    "camera_id": "traffic-1",
    "solution_pack": "sporada-secure",
    "application": "anpr",
    "event_type": "plate_read",
    "payload": {
      "plate": {"text": "KA04AB0826"},
      "subject": {"type": "license_plate", "confidence": 0.91, "track_id": 3487, "bbox": {"x1": 1003, "y1": 583, "x2": 1038, "y2": 596}},
      "snapshot_ref": "snapshots/traffic-1/plate-3487.jpg",
      "snapshot_url": "/snapshots/traffic-1/plate-3487.jpg",
      "snapshot_content_type": "image/jpeg",
      "snapshot_assets": {
        "event_frame": {"ref": "snapshots/traffic-1/plate-3487.jpg", "url": "/snapshots/traffic-1/plate-3487.jpg", "content_type": "image/jpeg"}
      }
    }
  },
  {
    "schema_version": "1.0",
    "event_id": "traffic-1:face_recognition:face_seen:face-0123456789abcdef0123456789abcdef",
    "timestamp": "2026-09-18T10:00:00Z",
    "camera_id": "traffic-1",
    "solution_pack": "sporada-secure",
    "application": "face_recognition",
    "event_type": "face_seen",
    "payload": {
      "sample_id": "face-0123456789abcdef0123456789abcdef",
      "model_id": "adaface-ir101-int8-v1",
      "embedding_space": "adaface-ir101-int8-v1:512:bgr-aligned-112",
      "face_quality": 0.87,
      "subject": {"type": "face", "confidence": 0.94, "track_id": 17, "bbox": {"x1": 430, "y1": 130, "x2": 505, "y2": 225}},
      "snapshot_ref": "snapshots/traffic-1/faces/face-0123456789abcdef0123456789abcdef-frame.jpg",
      "snapshot_url": "/snapshots/traffic-1/faces/face-0123456789abcdef0123456789abcdef-frame.jpg",
      "snapshot_content_type": "image/jpeg",
      "snapshot_assets": {
        "event_frame": {"ref": "snapshots/traffic-1/faces/face-0123456789abcdef0123456789abcdef-frame.jpg", "url": "/snapshots/traffic-1/faces/face-0123456789abcdef0123456789abcdef-frame.jpg", "content_type": "image/jpeg"},
        "face_crop": {"ref": "snapshots/traffic-1/faces/face-0123456789abcdef0123456789abcdef-face.jpg", "url": "/snapshots/traffic-1/faces/face-0123456789abcdef0123456789abcdef-face.jpg", "content_type": "image/jpeg"}
      }
    }
  }
]
