{
  "schema_version": "1.0",
  "event_id": "traffic-1:vehicle_counting:vehicle_count_per_frame:13051:2026-09-16T07:40:51.525044Z",
  "timestamp": "2026-09-16T07:40:51.525044Z",
  "camera_id": "traffic-1",
  "solution_pack": "sporada-secure",
  "application": "vehicle_counting",
  "event_type": "vehicle_count_per_frame",
  "payload": {
    "count": {
      "total": 2
    },
    "location": {
      "id": "traffic-1-vehicle-zone",
      "name": "vehicle_zone",
      "type": "zone"
    },
    "objects": [
      {
        "type": "car",
        "confidence": 0.94,
        "track_id": 41,
        "bbox": {
          "x1": 110,
          "y1": 220,
          "x2": 410,
          "y2": 570
        }
      },
      {
        "type": "motorcycle",
        "confidence": 0.88,
        "track_id": 52,
        "bbox": {
          "x1": 620,
          "y1": 250,
          "x2": 790,
          "y2": 610
        }
      }
    ],
    "snapshot_ref": "snapshots/traffic-1/vehicle-13051.jpg",
    "snapshot_url": "/snapshots/traffic-1/vehicle-13051.jpg",
    "snapshot_content_type": "image/jpeg",
    "snapshot_assets": {
      "event_frame": {
        "ref": "snapshots/traffic-1/vehicle-13051.jpg",
        "url": "/snapshots/traffic-1/vehicle-13051.jpg",
        "content_type": "image/jpeg"
      }
    }
  }
}